id,audio_file_path,journal_text,sentiment_analysis_result,upload_date,user_id_id,title
245,exercises/1/2024_09_20/Landmark_1_brian.mp3,"I experienced a deep sense of peace today, taking time to be thankful for all that’s going well. Life feels fulfilling right now.",Positive,2024-09-07 02:15:20,28,Negative Journal 245
246,exercises/1/2024_09_20/Landmark_1_brian.mp3,"Today, I felt immense gratitude for the love and joy in my life. Feeling happy and hopeful about the future.",Positive,2024-08-29 04:39:09,28,Negative Journal 246
247,exercises/1/2024_09_20/Landmark_1_brian.mp3,"I had a beautiful, calm day today, filled with a sense of purpose and fulfillment. It’s good to feel at peace.",Positive,2024-09-02 00:19:05,28,Negative Journal 247
248,exercises/1/2024_09_20/Landmark_1_brian.mp3,"Enjoyed a quiet, reflective moment today and felt positive about my journey. Life feels hopeful, and I’m embracing it fully.",Positive,2024-09-11 07:49:05,28,Negative Journal 248
249,exercises/1/2024_09_20/Landmark_1_brian.mp3,"Today, I took some time to pause and appreciate the small joys around me. It’s comforting to feel so content with where I am. Moments like these remind me of the value of mindfulness and gratitude.",Positive,2024-09-01 22:13:22,29,Negative Journal 249
250,exercises/1/2024_09_20/Landmark_1_brian.mp3,"I spent the afternoon practicing self-care, which helped lift my spirits immensely. Feeling recharged and ready to face whatever comes next. It’s amazing how little moments of care can have such a positive effect.",Positive,2024-09-19 13:03:38,29,Negative Journal 250
251,exercises/1/2024_09_20/Landmark_1_brian.mp3,Today was filled with moments of joy and laughter. I feel so grateful for the love and support in my life. It’s a reminder that happiness often comes from the people who matter most.,Positive,2024-09-17 20:54:01,29,Negative Journal 251
252,exercises/1/2024_09_20/Landmark_1_brian.mp3,"After a long week, today I felt truly peaceful and fulfilled. Spending time in reflection helped me recognize how far I’ve come. Grateful for the resilience and strength that carry me forward.",Positive,2024-09-24 21:18:41,29,Negative Journal 252
253,exercises/1/2024_09_20/Landmark_1_brian.mp3,"I felt a sense of contentment wash over me today, just by focusing on the present. It’s easy to forget how grounding it is to live in the moment. Feeling hopeful and grateful for today.",Positive,2024-09-01 12:24:18,30,Negative Journal 253
254,exercises/1/2024_09_20/Landmark_1_brian.mp3,"Spent some quiet time outdoors, which left me feeling recharged and connected to nature. I feel so much gratitude for the beauty around me. It’s a good reminder to slow down and appreciate life.",Positive,2024-09-15 21:37:10,30,Negative Journal 254
255,exercises/1/2024_09_20/Landmark_1_brian.mp3,"Today, I felt deeply connected to my emotions and found peace in simple moments. It’s wonderful to feel this calm and balanced. Embracing joy, even in the small things, brings so much fulfillment.",Positive,2024-09-12 15:09:55,30,Negative Journal 255
256,exercises/1/2024_09_20/Landmark_1_brian.mp3,Had a peaceful day filled with gratitude for the things I often take for granted. It’s comforting to recognize the abundance in my life. Feeling more grounded than I have in a long time.,Positive,2024-09-17 22:56:47,30,Negative Journal 256
257,exercises/1/2024_09_20/Landmark_1_brian.mp3,"Today was a reminder of how fulfilling it is to focus on self-care and mindfulness. I feel content and hopeful, like I’m finally finding my balance again.",Positive,2024-09-10 12:05:26,30,Negative Journal 257
258,exercises/1/2024_09_20/Landmark_1_brian.mp3,"Today was one of those days where everything felt balanced and aligned. I feel grateful for the inner peace that’s come from focusing on self-care. Life feels fulfilling, and I’m appreciative of this calm. I want to hold onto this feeling and carry it forward.",Positive,2024-09-17 05:32:02,30,Negative Journal 258
259,exercises/1/2024_09_20/Landmark_1_brian.mp3,"I took time today to journal about all the things I’m thankful for, and it brought me so much joy. Focusing on gratitude has been a powerful way to boost my outlook on life. It’s wonderful to feel so positive and content. Life feels lighter when I focus on the good.",Positive,2024-08-27 01:44:53,30,Negative Journal 259
260,exercises/1/2024_09_20/Landmark_1_brian.mp3,"I experienced a true sense of calm today, as though all my worries had melted away. It’s moments like these that remind me how precious peace is. I’m feeling resilient and ready to face any challenges that come my way. Grateful for the strength within me.",Positive,2024-09-24 20:09:12,30,Negative Journal 260
261,exercises/1/2024_09_20/Landmark_1_brian.mp3,"Today, I treated myself to some quiet time with a warm cup of tea and my thoughts. It’s amazing how recharged I feel from something so simple. I felt connected to myself in a way that’s rare in the hustle of daily life. It’s a reminder to create more moments like this.",Positive,2024-08-29 03:41:55,30,Negative Journal 261
262,exercises/1/2024_09_20/Landmark_1_brian.mp3,"Spending time with close friends today reminded me of the joy that comes from meaningful connections. I feel grateful for the laughter, warmth, and love that they bring to my life. It’s refreshing to be around people who make me feel appreciated and happy. Moments like these keep me going.",Positive,2024-09-11 12:46:48,30,Negative Journal 262
263,exercises/1/2024_09_20/Landmark_1_brian.mp3,"I spent time meditating today, and it brought me a profound sense of calm. Letting go of stress and focusing on inner peace made me feel grounded. I’m grateful for the clarity that these moments bring. Life feels more balanced when I make time for myself.",Positive,2024-08-29 23:55:52,31,Negative Journal 263
264,exercises/1/2024_09_20/Landmark_1_brian.mp3,"Today, I cooked a meal from scratch and found so much joy in the process. It was fulfilling to take time for something creative and nourishing. This simple act brought me a lot of satisfaction. I feel reconnected to myself in a way I didn’t expect.",Positive,2024-09-19 23:31:13,31,Negative Journal 264
265,exercises/1/2024_09_20/Landmark_1_brian.mp3,I felt a wave of optimism today as I reflected on the personal goals I’ve set for myself. It’s encouraging to see the progress I’ve made and feel capable of achieving even more. This positive outlook has boosted my confidence. I’m grateful for the sense of purpose this brings.,Positive,2024-09-24 00:48:14,31,Negative Journal 265
266,exercises/1/2024_09_20/Landmark_1_brian.mp3,"Today, I felt truly at peace after spending time journaling about my dreams and aspirations. Putting my thoughts on paper brought clarity and inspiration. I’m hopeful for the future and the journey ahead. It’s refreshing to feel this motivated.",Positive,2024-09-22 06:19:17,31,Negative Journal 266
267,exercises/1/2024_09_20/Landmark_1_brian.mp3,"I took time for a quiet walk in the park today, appreciating the beauty of nature. It was calming and gave me a sense of connection to the world around me. I feel grateful for this chance to slow down and recharge. These peaceful moments mean everything.",Positive,2024-09-17 18:08:25,31,Negative Journal 267
268,exercises/1/2024_09_20/Landmark_1_brian.mp3,"Today, I realized how much I’ve grown emotionally over the past few months. I feel stronger, more resilient, and proud of the journey I’m on. Reflecting on my progress brought a deep sense of fulfillment. I’m excited to keep building on this foundation.",Positive,2024-09-11 05:21:24,31,Negative Journal 268
269,exercises/1/2024_09_20/Landmark_1_brian.mp3,"I spent the evening listening to music that I love, and it brought me so much joy. There’s something incredibly soothing about connecting to memories through music. I feel rejuvenated and grateful for these comforting moments. It’s amazing how much music can heal.",Positive,2024-09-07 19:57:21,31,Negative Journal 269
270,exercises/1/2024_09_20/Landmark_1_brian.mp3,"Today, I felt a deep sense of satisfaction after organizing my personal space. Having a clear, peaceful environment has done wonders for my mindset. I feel more focused and centered. It’s a reminder of the power of a little self-care.",Positive,2024-09-12 16:37:06,31,Negative Journal 270
271,exercises/1/2024_09_20/Landmark_1_brian.mp3,"I woke up feeling positive and energized, ready to take on the day with a fresh outlook. This renewed energy has given me a sense of excitement for what’s ahead. I’m grateful for days like these where everything feels balanced. Life feels full of possibility.",Positive,2024-09-21 08:56:14,31,Negative Journal 271
272,exercises/1/2024_09_20/Landmark_1_brian.mp3,"Today was a rough day. I felt tired and emotionally drained, struggling to keep a positive outlook.",Negative,2024-09-20 21:30:02,31,Negative Journal 272
273,exercises/1/2024_09_20/Landmark_1_brian.mp3,I felt disconnected from everyone around me. This lingering sadness has been tough to shake off.,Negative,2024-09-05 11:24:02,31,Negative Journal 273
274,exercises/1/2024_09_20/Landmark_1_brian.mp3,Feeling helpless and moody today. It’s difficult when things feel out of my control.,Negative,2024-09-10 02:08:22,32,Negative Journal 274
275,exercises/1/2024_09_20/Landmark_1_brian.mp3,I’ve been feeling anxious and emotionally exhausted lately. It’s been challenging to stay focused.,Negative,2024-09-20 00:05:00,32,Negative Journal 275
276,exercises/1/2024_09_20/Landmark_1_brian.mp3,"Today was a struggle emotionally. I’m feeling tired and disconnected, unsure of how to find my way back.",Negative,2024-08-31 12:47:30,32,Negative Journal 276
277,exercises/1/2024_09_20/Landmark_1_brian.mp3,"The stress is starting to take a toll, leaving me emotionally drained. It’s tough to stay positive when burnout looms.",Negative,2024-08-28 11:24:01,32,Negative Journal 277
278,exercises/1/2024_09_20/Landmark_1_brian.mp3,"Feeling anxious and overwhelmed today. The sadness is heavy, and it’s hard to shake the feeling of helplessness.",Negative,2024-08-30 05:41:57,32,Negative Journal 278
279,exercises/1/2024_09_20/Landmark_1_brian.mp3,"Today, I struggled with feelings of disillusionment. It’s exhausting to feel emotionally drained day after day.",Negative,2024-09-07 02:21:32,32,Negative Journal 279
280,exercises/1/2024_09_20/Landmark_1_brian.mp3,I’m feeling a strong sense of sadness and emotional exhaustion today. It’s tough to find motivation in this state.,Negative,2024-09-11 06:04:46,32,Negative Journal 280
281,exercises/1/2024_09_20/Landmark_1_brian.mp3,Today was another lonely day. The feeling of being disconnected from everyone around me is hard to overcome.,Negative,2024-09-02 08:44:30,32,Negative Journal 281
282,exercises/1/2024_09_20/Landmark_1_brian.mp3,Feeling moody and emotionally raw today. It’s challenging to keep pushing through when it feels like nothing is improving.,Negative,2024-09-14 19:42:36,32,Negative Journal 282
283,exercises/1/2024_09_20/Landmark_1_brian.mp3,"Today, I felt emotionally exhausted and anxious. The weight of everything is starting to feel overwhelming.",Negative,2024-09-08 07:27:47,32,Negative Journal 283
284,exercises/1/2024_09_20/Landmark_1_brian.mp3,"The loneliness hit me again today, making it hard to focus. It’s difficult to see past the sadness and isolation.",Negative,2024-09-19 12:17:47,32,Negative Journal 284
285,exercises/1/2024_09_20/Landmark_1_brian.mp3,Today was a struggle; I felt tired and emotionally worn out. The weight of everything seems harder to manage lately. It’s tough when I can’t seem to shake this lingering sadness.,Negative,2024-09-04 12:55:31,32,Negative Journal 285
286,exercises/1/2024_09_20/Landmark_1_brian.mp3,"I’ve been feeling disconnected, like I’m out of sync with everything around me. The loneliness hit hard today, making it difficult to stay positive. It’s challenging to face these feelings alone.",Negative,2024-09-22 15:14:50,32,Negative Journal 286
287,exercises/1/2024_09_20/Landmark_1_brian.mp3,"Today, I felt overwhelmed by a mix of anxiety and sadness. It’s tough to keep going when everything feels uncertain and heavy. I wish I could find a way to ease these emotions.",Negative,2024-09-25 09:02:58,33,Negative Journal 287
288,exercises/1/2024_09_20/Landmark_1_brian.mp3,"I felt emotionally drained again today, struggling to find the energy to do much of anything. The burnout is starting to take its toll. I just hope things will get easier soon.",Negative,2024-09-07 08:53:19,33,Negative Journal 288
289,exercises/1/2024_09_20/Landmark_1_brian.mp3,"Feeling a bit lost and unsure of my direction today. It’s hard to focus with these persistent feelings of sadness. I’m hoping for some clarity, but it feels far off.",Negative,2024-09-25 14:30:23,33,Negative Journal 289
290,exercises/1/2024_09_20/Landmark_1_brian.mp3,"The loneliness has been getting to me, and today it felt even more intense. It’s tough to manage everything when the emotional toll keeps growing. I wish I had more support.",Negative,2024-09-18 08:59:07,34,Negative Journal 290
291,exercises/1/2024_09_20/Landmark_1_brian.mp3,"Today was another hard day, with feelings of helplessness creeping in. I’m finding it difficult to stay motivated. The emotional exhaustion feels overwhelming at times.",Negative,2024-08-26 14:12:43,34,Negative Journal 291
292,exercises/1/2024_09_20/Landmark_1_brian.mp3,"I’ve been feeling moody and disconnected lately. Today, I struggled with sadness that feels hard to define. It’s tiring to carry this weight alone.",Negative,2024-09-16 15:22:05,34,Negative Journal 292
293,exercises/1/2024_09_20/Landmark_1_brian.mp3,"Today, I felt the weight of burnout. The stress and emotional strain have left me feeling drained. I’m trying to find balance, but it’s challenging.",Negative,2024-09-16 16:41:29,34,Negative Journal 293
294,exercises/1/2024_09_20/Landmark_1_brian.mp3,"The emotional exhaustion hit hard today, making it difficult to see past the struggles. It’s tough to carry on with this much sadness. I’m hoping things will look up soon.",Negative,2024-09-14 06:54:35,34,Negative Journal 294
295,exercises/1/2024_09_20/Landmark_1_brian.mp3,"Today, I felt overwhelmed by a mix of emotions that I couldn’t quite place. There’s an underlying sadness that’s hard to shake, and it’s affecting my energy. I wish I could find some clarity amidst this feeling. It’s exhausting to carry this emotional weight alone.",Negative,2024-09-10 10:20:04,34,Negative Journal 295
296,exercises/1/2024_09_20/Landmark_1_brian.mp3,"The loneliness hit particularly hard today, making me feel disconnected from everyone around me. It’s tough to manage these emotions when they seem so persistent. I keep hoping for a shift, but it feels far off. This isolation is starting to wear on me.",Negative,2024-08-31 09:34:38,34,Negative Journal 296
297,exercises/1/2024_09_20/Landmark_1_brian.mp3,"I felt emotionally vulnerable all day, as though I was on the edge of tears without really knowing why. It’s exhausting to feel this way without any clear cause. I wish I could just feel stable and secure. The emotional strain is taking its toll.",Negative,2024-08-31 07:28:35,34,Negative Journal 297
298,exercises/1/2024_09_20/Landmark_1_brian.mp3,"Today, I struggled with intense anxiety, feeling like everything was spiraling out of control. The sense of helplessness was almost paralyzing. It’s hard to function when these feelings become so overwhelming. I just want to find peace within myself again.",Negative,2024-09-24 04:12:15,34,Negative Journal 298
299,exercises/1/2024_09_20/Landmark_1_brian.mp3,"It was a tough day emotionally, and I found myself feeling lost and without direction. This feeling of aimlessness is frustrating and makes me doubt myself. I wish I could see a clearer path forward. It’s challenging to stay hopeful amidst this uncertainty.",Negative,2024-09-17 00:25:58,34,Negative Journal 299
300,exercises/1/2024_09_20/Landmark_1_brian.mp3,"Today, I felt emotionally disconnected from everything and everyone around me. It’s as though I’m watching life from the outside, unable to fully engage. I want to feel present again, but it’s difficult when this feeling of distance lingers. It’s an isolating experience.",Negative,2024-09-19 22:47:26,34,Negative Journal 300
301,exercises/1/2024_09_20/Landmark_1_brian.mp3,"The weight of stress feels unmanageable today, and I’m not sure how to regain control. Everything seems to be piling up, and I feel overwhelmed by it all. I wish I could find some relief from these emotions. It’s hard to keep pushing forward.",Negative,2024-09-16 10:35:12,34,Negative Journal 301
302,exercises/1/2024_09_20/Landmark_1_brian.mp3,"I woke up feeling anxious for no clear reason, and it’s stayed with me all day. This constant feeling of unease is exhausting and makes it hard to focus. I wish I could find a way to calm my mind. It’s challenging to function like this.",Negative,2024-09-11 23:51:20,34,Negative Journal 302
303,exercises/1/2024_09_20/Landmark_1_brian.mp3,"Today, I felt an overwhelming sadness that’s hard to explain. It’s as if a heavy cloud is following me around, and I don’t know how to lift it. I want to feel happy, but right now, it seems out of reach. I hope tomorrow brings some relief.",Negative,2024-09-14 20:57:16,34,Negative Journal 303
304,exercises/1/2024_09_20/Landmark_1_brian.mp3,"The feeling of loneliness has been intense today, leaving me feeling isolated and misunderstood. It’s tough not having someone to share these emotions with. I wish I felt more connected to those around me. This solitude is difficult to bear.",Negative,2024-09-13 07:23:40,34,Negative Journal 304
305,exercises/1/2024_09_20/Landmark_1_brian.mp3,"Today, I felt emotionally fragile, like even the smallest thing could push me over the edge. It’s unsettling to feel so vulnerable, and I wish I could find a way to feel more stable. This constant emotional strain is wearing me down. I’m longing for peace.",Negative,2024-09-05 09:16:50,35,Negative Journal 305
306,exercises/1/2024_09_20/Landmark_1_brian.mp3,"I’ve been feeling emotionally drained all day, as if there’s nothing left to give. It’s tough to keep going when it feels like I’m running on empty. I want to feel motivated, but everything feels overwhelming right now. It’s hard not to feel defeated.",Negative,2024-09-05 13:03:56,35,Negative Journal 306
307,exercises/1/2024_09_20/Landmark_1_brian.mp3,"Today, I struggled with a strong sense of helplessness, like nothing I do will make a difference. It’s challenging to stay positive when this feeling is so persistent. I just want to find a way to feel empowered again. This emotional exhaustion is taking its toll.",Negative,2024-09-17 20:58:35,35,Negative Journal 307
308,exercises/1/2024_09_20/Landmark_1_brian.mp3,"I felt emotionally detached from myself today, as if I were observing my life from a distance. It’s unsettling to feel so disconnected from my own thoughts and emotions. I want to feel whole again, but it seems elusive. This emptiness is hard to shake.",Negative,2024-09-02 18:52:04,35,Negative Journal 308
309,exercises/1/2024_09_20/Landmark_1_brian.mp3,"Today, I felt a mix of sadness and frustration that left me feeling mentally exhausted. No matter how much I tried to push through, the emotions lingered. It’s difficult to function when you’re feeling this way. I just hope tomorrow brings a fresh start.",Negative,2024-09-14 03:45:20,36,Negative Journal 309
310,exercises/1/2024_09_20/Landmark_1_brian.mp3,"Today, I spent the morning reorganizing my bookshelf, and it felt oddly satisfying. I rediscovered a few books I had completely forgotten about. It’s a little project, but seeing everything neat brings a surprising amount of joy. I may tackle the closet next!",Positive,2024-08-30 00:57:12,36,Negative Journal 310
311,exercises/1/2024_09_20/Landmark_1_brian.mp3,"I tried a new recipe today, and though it didn’t turn out as expected, the process was fun. I realized that cooking has a calming effect on me. The kitchen was a mess, but it was worth it. Maybe next time, I’ll try something simpler.",Positive,2024-08-27 10:52:13,36,Negative Journal 311
312,exercises/1/2024_09_20/Landmark_1_brian.mp3,"I spent a few hours at the local park, just watching people go about their day. It’s fascinating to see how everyone has their own unique rhythm and purpose. I felt strangely connected to the world by simply observing. Sometimes, it’s nice to just be a quiet spectator.",Positive,2024-09-22 12:18:44,36,Negative Journal 312
313,exercises/1/2024_09_20/Landmark_1_brian.mp3,"Today, I finally got around to fixing that squeaky door in the house. It was a small task, but crossing it off my to-do list felt rewarding. It’s amazing how little things can make a difference in how a home feels. Now, no more annoying squeaks!",Positive,2024-08-28 19:15:24,36,Negative Journal 313
314,exercises/1/2024_09_20/Landmark_1_brian.mp3,"I decided to spend some time sketching today, and it felt so good to do something creative. I forgot how much I enjoy the feeling of pencil on paper. It’s not perfect, but it’s mine. I should make time for this more often.",Positive,2024-09-24 09:35:28,36,Negative Journal 314
315,exercises/1/2024_09_20/Landmark_1_brian.mp3,"Took a long walk through my neighborhood this evening, and I noticed so many little details I had overlooked before. It’s amazing how different everything feels when you’re truly present. The fresh air cleared my mind. I think I’ll make evening walks a regular thing.",Positive,2024-09-18 10:27:09,36,Negative Journal 315
316,exercises/1/2024_09_20/Landmark_1_brian.mp3,"Today, I cleaned out my old emails, deleting hundreds of messages I no longer need. It was surprisingly satisfying to declutter my digital space. It’s like a weight lifted off my shoulders. Now, I feel ready to tackle the rest of the week!",Positive,2024-08-28 08:02:50,36,Negative Journal 316
317,exercises/1/2024_09_20/Landmark_1_brian.mp3,I binge-watched an entire season of a show I just discovered. It felt nice to just relax and get lost in someone else’s story. It’s been a while since I let myself unwind like this. A perfect lazy day if you ask me.,Positive,2024-09-22 06:25:47,36,Negative Journal 317
318,exercises/1/2024_09_20/Landmark_1_brian.mp3,"I picked up my guitar after months and played a few songs. My fingers were rusty, but the music felt as comforting as ever. It’s like reconnecting with an old friend. I’m going to keep this going, even if it’s just a few minutes a day.",Positive,2024-09-04 15:37:27,36,Negative Journal 318
319,exercises/1/2024_09_20/Landmark_1_brian.mp3,"Today, I browsed through old photos and reminisced about past travels. It’s amazing how many memories can be packed into a single image. I feel a little nostalgic, but grateful for all those experiences. Maybe it’s time to start planning another adventure.",Positive,2024-09-21 16:15:38,36,Negative Journal 319
320,exercises/1/2024_09_20/Landmark_1_brian.mp3,"I spent the evening playing board games with family, and we laughed more than we have in a while. It’s these simple moments that remind me of the importance of quality time. Winning wasn’t the point; it was just about being together. Definitely a night to remember.",Positive,2024-09-03 03:25:15,36,Negative Journal 320
321,exercises/1/2024_09_20/Landmark_1_brian.mp3,"I decided to try meditation today, and though I was restless at first, it eventually brought a sense of calm. Focusing on my breathing helped me tune out the noise of everyday life. It’s a new habit I’d like to develop. Small steps toward inner peace.",Positive,2024-08-30 17:38:50,36,Negative Journal 321
322,exercises/1/2024_09_20/Landmark_1_brian.mp3,"Today, I watered my plants and noticed they’re thriving. It’s nice to see something I care for grow and flourish. Gardening is surprisingly rewarding. I think I’ll add a few more plants to my collection.",Positive,2024-09-10 18:30:18,36,Negative Journal 322
323,exercises/1/2024_09_20/Landmark_1_brian.mp3,"Today, I found an old journal entry from years ago and spent some time reading through it. It was interesting to see how much I’ve changed and grown. Reflecting on my younger self gave me a fresh perspective. Growth really is a journey.",Positive,2024-08-27 02:18:44,36,Negative Journal 323
324,exercises/1/2024_09_20/Landmark_1_brian.mp3,"I spent the afternoon reorganizing my kitchen cupboards. It was long overdue, and now everything has its place. Cooking will be so much easier with a clear setup. Small changes make such a big difference.",Positive,2024-09-14 05:07:15,37,Negative Journal 324
325,exercises/1/2024_09_20/Landmark_1_brian.mp3,"Today, I took my dog to the park, and watching him run around freely was such a joy. There’s something so pure and happy about dogs in their element. Seeing him so content made my day brighter. We should do this more often.",Positive,2024-09-21 19:51:08,37,Negative Journal 325
326,exercises/1/2024_09_20/Landmark_1_brian.mp3,"I finally tried a yoga class online, and it was more challenging than I thought. It felt good to stretch and focus on my body’s movements. I think I’ll make this a regular part of my week. It’s nice to find a new way to unwind.",Positive,2024-09-13 19:37:42,37,Negative Journal 326
327,exercises/1/2024_09_20/Landmark_1_brian.mp3,"I spent the morning listening to old records, and it took me back to simpler times. There’s a warmth in the crackling sound that streaming music just doesn’t have. It felt like a cozy, nostalgic trip. I should pull these out more often.",Positive,2024-09-07 14:19:37,38,Negative Journal 327
