id,audio_file_path,journal_text,sentiment_analysis_result,upload_date,user_id_id,title
166,exercises/1/2024_09_20/Landmark_1_brian.mp3,Leadership seems out of touch with our daily struggles. It’s tough to feel motivated when they don’t address our concerns.,Negative,2024-09-25 08:26:13,20,Positive Journal 166
167,exercises/1/2024_09_20/Landmark_1_brian.mp3,"I’ve noticed a decline in team dynamics lately, likely due to the heavy workload. People are starting to show signs of burnout.",Negative,2024-09-06 01:07:11,20,Negative Journal 167
168,exercises/1/2024_09_20/Landmark_1_brian.mp3,"Today, I felt frustrated with the lack of direction. It’s hard to keep going when leadership isn’t providing clear guidance.",Negative,2024-09-08 02:11:28,20,Positive Journal 168
169,exercises/1/2024_09_20/Landmark_1_brian.mp3,The disrespect and lack of recognition from management are starting to take a toll. It’s becoming harder to stay motivated.,Negative,2024-09-10 03:02:03,20,Negative Journal 169
170,exercises/1/2024_09_20/Landmark_1_brian.mp3,Another day without support or acknowledgment from leadership. It’s exhausting to constantly push without any sign of appreciation.,Negative,2024-09-08 18:42:33,20,Negative Journal 170
171,exercises/1/2024_09_20/Landmark_1_brian.mp3,"The workload has been relentless, and I’m starting to feel the effects of burnout creeping in. It’s tough when leadership doesn’t acknowledge the pressure we’re under. I just hope they realize soon how much we need additional support.",Negative,2024-09-20 14:54:00,20,Negative Journal 171
172,exercises/1/2024_09_20/Landmark_1_brian.mp3,"Today, I felt frustrated by the lack of recognition for our team’s efforts. It’s discouraging when leadership doesn’t acknowledge the hard work we put in day after day. A little appreciation could go a long way in lifting morale.",Negative,2024-09-24 08:32:50,20,Positive Journal 172
173,exercises/1/2024_09_20/Landmark_1_brian.mp3,"The team is stretched thin due to constant understaffing, and everyone’s feeling the pressure. We’re expected to take on more than what’s realistic, yet there’s no sign of relief. It’s starting to take a toll on our motivation.",Negative,2024-09-24 11:20:48,20,Negative Journal 173
174,exercises/1/2024_09_20/Landmark_1_brian.mp3,Today was another day where I felt the lack of respect from some senior colleagues. It’s disheartening to feel undervalued despite putting in so much effort. Respect and recognition are so important for staying motivated.,Negative,2024-09-09 07:44:31,20,Negative Journal 174
175,exercises/1/2024_09_20/Landmark_1_brian.mp3,"Leadership seems out of touch with the struggles we face daily, especially with such high demands. I wish they’d take time to listen and address our concerns. Right now, it feels like we’re being left to fend for ourselves.",Negative,2024-08-30 12:55:03,21,Negative Journal 175
176,exercises/1/2024_09_20/Landmark_1_brian.mp3,"I encountered another instance of blurred role boundaries, which has been a persistent issue here. It’s exhausting to work in an environment with such unclear expectations. A more defined structure could make things so much smoother.",Negative,2024-09-01 12:04:35,21,Negative Journal 176
177,exercises/1/2024_09_20/Landmark_1_brian.mp3,"With no recognition for the extra hours I’ve been putting in, it’s hard to stay motivated. Sometimes, a simple acknowledgment would make a big difference. Right now, it just feels like my work is going unnoticed.",Negative,2024-09-19 13:09:00,21,Negative Journal 177
178,exercises/1/2024_09_20/Landmark_1_brian.mp3,"The constant demand to perform without any support is starting to weigh on everyone. We need better communication and leadership that values our well-being. Without it, burnout feels inevitable.",Negative,2024-09-17 17:29:48,21,Negative Journal 178
179,exercises/1/2024_09_20/Landmark_1_brian.mp3,"Today, I felt drained by the lack of respect in the workplace. It’s tough to keep up with all the demands when you don’t feel valued. A little appreciation would make all the difference.",Negative,2024-09-02 07:38:02,22,Negative Journal 179
180,exercises/1/2024_09_20/Landmark_1_brian.mp3,"The lack of team cohesion is becoming more noticeable with every passing day. Everyone seems too overworked to even communicate effectively, which is affecting our productivity. Leadership hasn’t done much to address the growing tension. I just hope they’ll step in before it impacts our work further.",Negative,2024-08-29 14:16:15,22,Negative Journal 180
181,exercises/1/2024_09_20/Landmark_1_brian.mp3,"Today, I was reminded again how stretched thin we are as a team. We’re all balancing impossible workloads, yet there’s no sign of extra resources or support. It’s exhausting to try and keep up with these demands. I wish leadership would address the issue instead of piling on more tasks.",Negative,2024-09-20 08:05:53,22,Negative Journal 181
182,exercises/1/2024_09_20/Landmark_1_brian.mp3,"The absence of clear communication from leadership is causing a lot of confusion. It feels like we’re constantly in the dark about priorities, making it hard to focus on what’s truly important. This uncertainty is draining our motivation and causing a lot of unnecessary stress. I wish there was a stronger direction.",Negative,2024-09-02 21:58:56,22,Negative Journal 182
183,exercises/1/2024_09_20/Landmark_1_brian.mp3,"Today, I felt demoralized by the lack of trust in our team from upper management. They seem to micromanage us without giving us the freedom to do our jobs effectively. It’s frustrating when you’re constantly questioned instead of being trusted. It’s starting to take away the satisfaction I once found in my work.",Negative,2024-09-01 16:54:28,22,Positive Journal 183
184,exercises/1/2024_09_20/Landmark_1_brian.mp3,The constant pressure to perform without recognition is starting to wear on me. Leadership’s lack of acknowledgment makes it feel like we’re just cogs in the machine. It’s difficult to keep putting in the effort when there’s no appreciation for it. I wish they’d take a moment to value our hard work.,Negative,2024-08-30 03:02:03,22,Negative Journal 184
185,exercises/1/2024_09_20/Landmark_1_brian.mp3,"Today, I saw firsthand how the lack of resources is impacting patient care and team morale. We simply don’t have the manpower to keep up with everything, and it’s leaving everyone frustrated and exhausted. Leadership seems to overlook this glaring issue, which makes us feel even more unsupported. It’s disheartening to work so hard and still feel like it’s not enough.",Negative,2024-09-18 14:55:33,22,Positive Journal 185
186,exercises/1/2024_09_20/Landmark_1_brian.mp3,"It’s frustrating to see leadership constantly shifting priorities without consulting us. We’re left scrambling to adapt, which is affecting both our productivity and morale. It would help if they trusted us enough to be part of the decision-making process. This lack of involvement leaves us feeling like we don’t have a voice.",Negative,2024-09-22 06:09:19,23,Negative Journal 186
187,exercises/1/2024_09_20/Landmark_1_brian.mp3,"Today, I experienced yet another instance of leadership failing to listen to our concerns. We’ve been vocal about needing additional resources, but it feels like our words go unheard. The workload is only increasing, and the lack of response is draining. It’s hard to stay motivated when leadership doesn’t seem to care.",Negative,2024-09-16 20:10:08,23,Negative Journal 187
188,exercises/1/2024_09_20/Landmark_1_brian.mp3,"I’m feeling the impact of the constant turnover in our team, as we’re often short-staffed and struggling to keep up. Leadership hasn’t addressed the root causes of this issue, which only adds to our frustration. It’s difficult to stay productive when we’re always in a state of adjustment. I wish they would provide more stability.",Negative,2024-09-01 01:25:07,23,Negative Journal 188
189,exercises/1/2024_09_20/Landmark_1_brian.mp3,"Today, I noticed how a lack of proper training for new team members is impacting our efficiency. We’re expected to take on the extra burden of teaching them, which takes time away from our own work. Leadership doesn’t seem to acknowledge how this affects our productivity. It’s a strain that’s starting to feel unsustainable.",Negative,2024-09-14 14:41:52,23,Negative Journal 189
190,exercises/1/2024_09_20/Landmark_1_brian.mp3,"It’s becoming increasingly difficult to stay focused on quality when we’re pushed to prioritize speed. Leadership seems to be more concerned with numbers than actual outcomes, which is frustrating. It feels like we’re sacrificing our standards just to keep up with demands. I wish they understood the importance of balance.",Negative,2024-09-16 05:15:55,23,Negative Journal 190
191,exercises/1/2024_09_20/Landmark_1_brian.mp3,"Today, I felt the lack of autonomy within our team, as every decision seems to require multiple approvals. This constant need for permission hinders our efficiency and creativity. It’s hard to stay motivated when we can’t even make small changes to improve our workflow. I wish leadership trusted us to make decisions.",Negative,2024-09-03 12:28:52,23,Negative Journal 191
192,exercises/1/2024_09_20/Landmark_1_brian.mp3,"The lack of clarity in our goals is making it difficult to feel a sense of purpose at work. Leadership frequently changes direction, leaving us unsure of what we’re working towards. This inconsistency is affecting our motivation as a team. It’s hard to give our best when we don’t understand the bigger picture.",Negative,2024-08-26 04:59:41,24,Negative Journal 192
193,exercises/1/2024_09_20/Landmark_1_brian.mp3,"Today, I felt the emotional toll of a toxic team environment, with certain colleagues often resorting to negativity and criticism. Leadership has done little to address these dynamics, which is creating a lot of tension. Working in this atmosphere is draining and affects everyone’s morale. I wish leadership would intervene and support a healthier environment.",Negative,2024-09-21 23:54:00,24,Negative Journal 193
194,exercises/1/2024_09_20/Landmark_1_brian.mp3,"It’s challenging to feel connected to the team when we’re each handling such different workloads and there’s no collaboration. Leadership hasn’t facilitated opportunities for us to work together, which affects our unity. I miss the sense of camaraderie we used to have. It’s hard to keep going when everyone feels so isolated.",Negative,2024-09-13 06:28:31,24,Negative Journal 194
195,exercises/1/2024_09_20/Landmark_1_brian.mp3,"Today, I enrolled in a new training program to advance my skills. It feels good to invest in my own career growth.",Positive,2024-09-01 03:01:00,24,Negative Journal 195
196,exercises/1/2024_09_20/Landmark_1_brian.mp3,I had a meeting with a mentor who encouraged me to pursue a promotion. It’s inspiring to think about the possibilities ahead.,Positive,2024-09-23 05:09:54,24,Negative Journal 196
197,exercises/1/2024_09_20/Landmark_1_brian.mp3,Learning a new skill at work today has reignited my passion. I feel one step closer to my career goals.,Positive,2024-09-09 21:47:34,24,Negative Journal 197
198,exercises/1/2024_09_20/Landmark_1_brian.mp3,"Today, I received feedback that highlighted my potential for career progression. I’m feeling motivated to keep improving.",Positive,2024-09-03 02:49:19,24,Negative Journal 198
199,exercises/1/2024_09_20/Landmark_1_brian.mp3,I had a great discussion with my manager today about potential career progression opportunities. Feeling optimistic about my growth path.,Positive,2024-09-11 18:10:13,24,Negative Journal 199
200,exercises/1/2024_09_20/Landmark_1_brian.mp3,Attended a skills workshop today that broadened my perspective. I’m excited to incorporate what I learned into my daily work.,Positive,2024-09-08 21:39:24,24,Negative Journal 200
201,exercises/1/2024_09_20/Landmark_1_brian.mp3,"Today, I focused on honing a new skill relevant to my career goals. It’s motivating to see steady progress toward my aspirations.",Positive,2024-09-04 07:58:43,24,Negative Journal 201
202,exercises/1/2024_09_20/Landmark_1_brian.mp3,I’m feeling grateful for the chance to participate in training sessions. Each new skill brings me closer to my career objectives.,Positive,2024-09-13 07:58:02,24,Negative Journal 202
203,exercises/1/2024_09_20/Landmark_1_brian.mp3,"Had a productive feedback session today, which helped me identify areas for growth. It’s empowering to work on these actively.",Positive,2024-09-13 22:26:43,24,Negative Journal 203
204,exercises/1/2024_09_20/Landmark_1_brian.mp3,I attended a leadership seminar that left me inspired to take on more responsibilities. I’m eager to grow into a leadership role.,Positive,2024-08-30 00:26:21,24,Negative Journal 204
205,exercises/1/2024_09_20/Landmark_1_brian.mp3,Setting career goals today gave me a renewed sense of purpose. I’m excited to continue growing and expanding my skill set.,Positive,2024-08-27 22:06:17,24,Negative Journal 205
206,exercises/1/2024_09_20/Landmark_1_brian.mp3,"Today, I made strides in my personal development plan, focusing on skills that will help me advance. The growth feels energizing.",Positive,2024-09-15 23:03:34,24,Negative Journal 206
207,exercises/1/2024_09_20/Landmark_1_brian.mp3,I had a positive one-on-one with a mentor who offered great advice on skill-building. Feeling more confident in my career path.,Positive,2024-08-27 02:02:36,24,Negative Journal 207
208,exercises/1/2024_09_20/Landmark_1_brian.mp3,Took time to reflect on my achievements and realized how much I’ve grown. I’m excited to continue pursuing professional development.,Positive,2024-09-18 13:30:37,25,Negative Journal 208
209,exercises/1/2024_09_20/Landmark_1_brian.mp3,"Today, I had a mentoring session that helped me see my potential more clearly. My mentor encouraged me to focus on my strengths and set some exciting goals for the future. I feel motivated to keep working towards those aspirations.",Positive,2024-09-23 15:29:43,25,Negative Journal 209
210,exercises/1/2024_09_20/Landmark_1_brian.mp3,Attended a skill-building workshop that gave me fresh insights into my work. I’m excited to bring this knowledge back to my role and hopefully open doors for career progression. It’s empowering to know that growth is within reach.,Positive,2024-09-14 12:46:07,25,Negative Journal 210
211,exercises/1/2024_09_20/Landmark_1_brian.mp3,I had a positive one-on-one meeting with my manager who praised my recent progress. Knowing my work is recognized makes me even more committed to professional growth. I’m grateful for the support and direction I’m receiving.,Positive,2024-09-18 11:58:09,25,Negative Journal 211
212,exercises/1/2024_09_20/Landmark_1_brian.mp3,"Today, I worked on a new project that’s helping me expand my skill set. It’s exciting to be challenged and see myself grow. I feel like I’m making real progress toward my career goals.",Positive,2024-09-01 01:00:05,25,Negative Journal 212
213,exercises/1/2024_09_20/Landmark_1_brian.mp3,Feeling confident after completing a training session that directly aligns with my career goals. Every new skill I learn brings me one step closer to the career I envision. Growth is a rewarding journey.,Positive,2024-09-25 17:52:40,26,Negative Journal 213
214,exercises/1/2024_09_20/Landmark_1_brian.mp3,"Reflecting on my goals today, I feel optimistic about the professional path I’m carving out. Setting intentions for future growth has been empowering. I’m ready to put in the work to reach new heights.",Positive,2024-08-26 10:33:13,26,Negative Journal 214
215,exercises/1/2024_09_20/Landmark_1_brian.mp3,"I received some constructive feedback on my performance that highlighted areas where I need to improve. It’s a bit disheartening to realize I have more work to do, but I’m grateful for the chance to address my weaknesses. I’ll use this feedback to set clear goals for myself. Growth isn’t easy, but I know it’s necessary.",Positive,2024-08-30 08:14:51,26,Negative Journal 215
216,exercises/1/2024_09_20/Landmark_1_brian.mp3,"Attending a conference today gave me a fresh perspective on the skills I need to build to advance my career. I met so many inspiring professionals, and it made me realize how much there is to learn. I’m excited to implement new ideas and see where they lead. This experience has reignited my passion for growth.",Positive,2024-09-11 03:04:58,26,Negative Journal 216
217,exercises/1/2024_09_20/Landmark_1_brian.mp3,"I’ve been working towards a promotion, but today I learned that it’s not likely to happen soon. It’s disappointing to feel like my hard work hasn’t been recognized. Still, I’m determined to keep improving and prove my value. This setback won’t stop me from pursuing my goals.",Negative,2024-09-01 13:05:53,26,Negative Journal 217
218,exercises/1/2024_09_20/Landmark_1_brian.mp3,"My manager assigned me to lead a small team on a project, and it’s a big step in my career. It’s both exciting and intimidating to take on this responsibility. I’m looking forward to honing my leadership skills and building my confidence. It’s fulfilling to see my hard work lead to new opportunities.",Positive,2024-09-09 07:45:19,26,Negative Journal 218
219,exercises/1/2024_09_20/Landmark_1_brian.mp3,"Today, I felt stuck in my role, realizing there’s limited opportunity for growth. It’s frustrating to feel like I’m not progressing despite putting in so much effort. I know I need to find ways to keep myself motivated and engaged. I’m hoping for a clearer path forward soon.",Negative,2024-09-07 12:37:06,26,Negative Journal 219
220,exercises/1/2024_09_20/Landmark_1_brian.mp3,"I completed a new certification that directly applies to my current role, and it feels rewarding. It’s reassuring to know I’m actively enhancing my skill set and adding value to the team. This accomplishment has given me more confidence in my abilities. I’m eager to put this new knowledge to work.",Positive,2024-08-27 08:36:41,26,Negative Journal 220
221,exercises/1/2024_09_20/Landmark_1_brian.mp3,"Today, I had a great conversation with a colleague who shared their career journey, and it gave me hope for my own path. Their insights were motivating and made me see new possibilities for growth. I’m grateful for this exchange as it has encouraged me to set bolder career goals. I feel more empowered to take charge of my development.",Positive,2024-09-24 06:37:17,26,Negative Journal 221
222,exercises/1/2024_09_20/Landmark_1_brian.mp3,"I was hoping for a raise this year, but learned it won’t be possible due to budget constraints. It’s disappointing, especially given the effort I’ve put in. However, I’ll take this as a sign to focus on skill development instead. I’m determined to find other ways to feel valued and grow professionally.",Positive,2024-08-29 00:47:11,26,Negative Journal 222
223,exercises/1/2024_09_20/Landmark_1_brian.mp3,"Today, I set aside time to create a personal development plan focused on expanding my technical skills. Mapping out specific steps has given me a renewed sense of direction. It feels productive to know exactly what I need to work on. I’m excited to start checking off these goals one by one.",Positive,2024-09-21 01:26:39,26,Negative Journal 223
224,exercises/1/2024_09_20/Landmark_1_brian.mp3,I attended a leadership workshop that left me inspired to take on more responsibility. The sessions taught me strategies I can apply to my work immediately. I feel more confident about my potential to grow within the company. This experience has motivated me to seek out more leadership opportunities.,Positive,2024-09-17 15:30:02,26,Negative Journal 224
225,exercises/1/2024_09_20/Landmark_1_brian.mp3,"I felt frustrated today when I realized how long it’s taking to reach my career goals. I’m putting in the effort, but progress feels painfully slow. It’s tough to stay patient when you’re eager to move forward. I’ll keep pushing, but it’s hard not to feel disheartened.",Negative,2024-08-26 23:48:15,26,Negative Journal 225
226,exercises/1/2024_09_20/Landmark_1_brian.mp3,My manager recommended me for a skill-building course that aligns with my career ambitions. Knowing that they believe in my potential feels incredibly validating. This opportunity makes me feel more motivated and supported in my growth journey. I’m ready to make the most of this training.,Positive,2024-09-09 09:56:57,26,Negative Journal 226
227,exercises/1/2024_09_20/Landmark_1_brian.mp3,"Today, I reflected on my progress over the last year, and it’s uplifting to see how much I’ve learned. I’ve faced plenty of challenges, but each one has taught me valuable lessons. Seeing this growth makes me proud and motivated to keep pushing forward. I’m excited for what lies ahead.",Positive,2024-09-11 22:20:59,26,Negative Journal 227
228,exercises/1/2024_09_20/Landmark_1_brian.mp3,"I received some disappointing news about a promotion I was hoping for, as it was given to someone else. It’s tough to feel overlooked, especially after putting in so much effort. While it’s discouraging, I’ll use this as motivation to keep improving. I’m determined to make myself a stronger candidate for the next opportunity.",Positive,2024-08-29 15:45:53,26,Negative Journal 228
229,exercises/1/2024_09_20/Landmark_1_brian.mp3,"Today, I presented my project to senior management, and their positive feedback boosted my confidence. It’s rewarding to see my hard work recognized and appreciated by leadership. I feel more encouraged than ever to keep pursuing challenging projects. This acknowledgment has renewed my commitment to my career goals.",Positive,2024-09-16 19:11:20,26,Negative Journal 229
230,exercises/1/2024_09_20/Landmark_1_brian.mp3,"I’ve been feeling the need for a new challenge, and today I started exploring potential growth paths within the company. It’s both exciting and overwhelming to consider new directions. I’m setting goals to better align with my long-term aspirations. This shift feels like the fresh start I’ve been looking for.",Positive,2024-09-18 05:08:16,27,Negative Journal 230
231,exercises/1/2024_09_20/Landmark_1_brian.mp3,"Today, I felt disheartened by the lack of training resources available for skill development. It’s frustrating when growth feels limited by what’s accessible in the organization. I know I’ll have to find other ways to develop myself outside of work. It’s not ideal, but I’m committed to making it happen.",Positive,2024-09-05 12:44:58,27,Positive Journal 231
232,exercises/1/2024_09_20/Landmark_1_brian.mp3,"A mentor pointed out some areas for improvement today, and while it’s a bit humbling, I appreciate the honest feedback. It’s motivating to know exactly what I need to work on to reach my goals. I’m ready to take on the challenge of refining these skills. Growth isn’t always comfortable, but I know it’s necessary.",Positive,2024-09-21 15:06:31,27,Negative Journal 232
233,exercises/1/2024_09_20/Landmark_1_brian.mp3,"Today, I was given a task that feels like a stretch, and it’s both exciting and intimidating. It’s a chance to prove myself and demonstrate my ability to take on more responsibility. I feel grateful for this opportunity to expand my skills. I’m eager to see what I can accomplish with this new challenge.",Positive,2024-09-08 15:56:40,27,Negative Journal 233
234,exercises/1/2024_09_20/Landmark_1_brian.mp3,"Spent time outdoors today, feeling grateful and content. Sometimes it’s the simple things that bring joy.",Positive,2024-09-17 09:40:56,27,Negative Journal 234
235,exercises/1/2024_09_20/Landmark_1_brian.mp3,"Today, I focused on self-care, and it left me feeling recharged and peaceful. I feel more hopeful than I have in a while.",Positive,2024-09-07 03:02:55,27,Negative Journal 235
236,exercises/1/2024_09_20/Landmark_1_brian.mp3,Enjoyed a quiet evening filled with gratitude and contentment. It’s comforting to feel so at peace with myself.,Positive,2024-09-19 18:35:06,27,Positive Journal 236
237,exercises/1/2024_09_20/Landmark_1_brian.mp3,"Today, I felt resilient, facing each challenge with a positive attitude. I’m proud of my strength and growth.",Positive,2024-09-22 11:15:27,27,Negative Journal 237
238,exercises/1/2024_09_20/Landmark_1_brian.mp3,I had moments of joy today that reminded me to appreciate the present. Feeling fulfilled and happy.,Positive,2024-09-05 20:01:57,28,Negative Journal 238
239,exercises/1/2024_09_20/Landmark_1_brian.mp3,"Feeling hopeful and calm today, with a deep sense of contentment. Grateful for moments of peace.",Positive,2024-09-03 22:46:23,28,Negative Journal 239
240,exercises/1/2024_09_20/Landmark_1_brian.mp3,"Spent the day surrounded by loved ones, feeling positive and fulfilled. It was a much-needed reminder of joy.",Positive,2024-09-11 22:59:15,28,Negative Journal 240
241,exercises/1/2024_09_20/Landmark_1_brian.mp3,Took time to reflect on all I’m grateful for. Feeling content and at peace with where I am.,Positive,2024-09-25 15:13:06,28,Negative Journal 241
242,exercises/1/2024_09_20/Landmark_1_brian.mp3,"Today, I felt an overwhelming sense of gratitude. Every moment felt like a reminder of how fulfilling life can be.",Positive,2024-09-13 07:17:22,28,Negative Journal 242
243,exercises/1/2024_09_20/Landmark_1_brian.mp3,"Feeling content with where I am right now. Life feels balanced, and I’m grateful for the resilience that brought me here.",Positive,2024-09-21 09:33:36,28,Negative Journal 243
244,exercises/1/2024_09_20/Landmark_1_brian.mp3,I found happiness in a simple moment today. Feeling positive about the small things that bring light to my life.,Positive,2024-09-25 21:45:27,28,Negative Journal 244
