id,audio_file_path,journal_text,sentiment_analysis_result,upload_date,user_id_id,title
328,exercises/1/2024_09_20/Landmark_1_brian.mp3,"Today, I tried my hand at some light DIY crafts. I’m no artist, but there’s something fun about making something with your own hands. The results aren’t perfect, but they have a certain charm. It was a nice change from my usual routine.",Positive,2024-09-10 20:35:29,38,Negative Journal 328
329,exercises/1/2024_09_20/Landmark_1_brian.mp3,I had a quiet evening looking through my favorite poetry collection. Each poem feels like a little world to get lost in. It was soothing to revisit words that once brought me comfort. Poetry has a way of speaking directly to the soul.,Positive,2024-09-24 20:22:49,38,Positive Journal 329
330,exercises/1/2024_09_20/Landmark_1_brian.mp3,"Spent the day tending to my indoor plants, giving each one a bit of extra attention. I feel like a proud plant parent seeing them grow so well. It’s rewarding to nurture something, even if it’s just plants. They really brighten up my space.",Positive,2024-09-16 01:43:03,38,Positive Journal 330
331,exercises/1/2024_09_20/Landmark_1_brian.mp3,"I tried my first jigsaw puzzle today, and it was oddly therapeutic. The process of finding each piece’s place helped me unwind. It was satisfying to see the picture slowly come together. I might have found a new favorite hobby.",Positive,2024-08-30 16:28:33,38,Positive Journal 331
332,exercises/1/2024_09_20/Landmark_1_brian.mp3,"Today, I decided to take the scenic route home and discovered a beautiful little café along the way. It was a nice surprise and a welcome break from my usual routine. Sometimes, the unplanned moments are the best. I’ll definitely be back to try their coffee.",Positive,2024-09-24 02:01:32,38,Positive Journal 332
333,exercises/1/2024_09_20/Landmark_1_brian.mp3,I spent the afternoon sorting through old letters and mementos. It was a walk down memory lane that brought back a lot of emotions. Seeing how much I’ve grown since then is encouraging. I’m grateful for the memories and lessons along the way.,Positive,2024-09-03 17:34:56,38,Negative Journal 333
334,exercises/1/2024_09_20/Landmark_1_brian.mp3,"Today, I baked bread for the first time, and the smell filled the whole house. There’s something incredibly satisfying about making something from scratch. It didn’t come out perfect, but I’m proud of the effort. I’ll give it another try next week.",Positive,2024-09-01 13:24:36,38,Negative Journal 334
335,exercises/1/2024_09_20/Landmark_1_brian.mp3,"I went stargazing tonight, lying in the backyard and watching the night sky. It’s humbling to think about how vast the universe is. Moments like these make my worries feel small. I should spend more time appreciating the beauty above.",Positive,2024-09-23 04:46:13,39,Negative Journal 335
336,exercises/1/2024_09_20/Landmark_1_brian.mp3,"I watched a documentary on art history today, and it was fascinating. There’s so much about the world I still don’t know. It’s inspiring to learn about people who’ve dedicated their lives to creativity. It sparked a curiosity in me to explore new things.",Positive,2024-09-01 19:40:02,39,Negative Journal 336
337,exercises/1/2024_09_20/Landmark_1_brian.mp3,"Today, I tried a new form of journaling: gratitude journaling. Listing things I’m thankful for helped me reflect on the good in my life. It was a refreshing practice, and I felt more positive afterward. I think I’ll make it part of my daily routine.",Positive,2024-09-21 06:37:11,39,Negative Journal 337
338,exercises/1/2024_09_20/Landmark_1_brian.mp3,"I spent the evening writing in my journal, jotting down dreams and goals. It’s exciting to think about what the future might hold. There’s something powerful about putting your aspirations into words. I feel more inspired and motivated than ever.",Positive,2024-09-15 20:47:35,39,Negative Journal 338
339,exercises/1/2024_09_20/Landmark_1_brian.mp3,"I played board games online with friends tonight, and we laughed so much. It reminded me of all the fun we used to have in person. Even virtual connections feel meaningful when shared with the right people. I’m thankful for friends who bring joy into my life.",Positive,2024-09-16 07:14:37,39,Negative Journal 339
340,exercises/1/2024_09_20/Landmark_1_brian.mp3,"Today, I practiced a new language skill I’m learning, and it felt rewarding to see progress. I can now form basic sentences, and it’s exciting to feel growth. Language learning is challenging, but the small wins keep me motivated. I look forward to becoming more fluent.",Positive,2024-09-23 09:18:16,39,Negative Journal 340
341,exercises/1/2024_09_20/Landmark_1_brian.mp3,I spent some time today organizing my digital photos. It was fun revisiting old memories and seeing how much has changed. There’s something fulfilling about bringing order to the chaos of digital files. It’s a project I’ll continue until everything’s organized.,Positive,2024-09-03 20:28:33,39,Negative Journal 341
342,exercises/1/2024_09_20/Landmark_1_brian.mp3,Took a stroll around the neighborhood to enjoy the changing seasons. The colors and sounds of nature are so soothing. Being present in the moment reminded me of the beauty in everyday life. I feel refreshed and ready to take on the week.,Positive,2024-08-26 07:57:58,39,Negative Journal 342