id,audio_file_path,journal_text,sentiment_analysis_result,upload_date,user_id_id,title
92,exercises/1/2024_09_20/Landmark_1_brian.mp3,"It was heartwarming to see a patient smile after weeks of treatment. They mentioned feeling truly cared for, and moments like these remind me of the purpose behind every compassionate gesture.",Positive,2024-09-14 14:59:58,10,Negative Journal 92
93,exercises/1/2024_09_20/Landmark_1_brian.mp3,"A patient’s family thanked me today, saying that my care helped their loved one’s progressive recovery. Knowing I’m trusted means everything.",Positive,2024-08-31 20:52:50,10,Negative Journal 93
94,exercises/1/2024_09_20/Landmark_1_brian.mp3,"Today, I received positive feedback from a patient who felt genuinely satisfied with the attention they received. It’s incredibly motivating to see my efforts make a difference.",Positive,2024-09-03 04:35:34,10,Negative Journal 94
95,exercises/1/2024_09_20/Landmark_1_brian.mp3,"After a challenging week, seeing a patient show signs of recovery feels rewarding. The satisfaction on their face is a reminder of why I chose this field.",Positive,2024-09-16 11:55:06,11,Negative Journal 95
96,exercises/1/2024_09_20/Landmark_1_brian.mp3,Another successful day! A patient expressed gratitude for the time and care I provided. Their feedback brought a real sense of fulfillment.,Positive,2024-09-04 03:48:36,11,Positive Journal 96
97,exercises/1/2024_09_20/Landmark_1_brian.mp3,"Today, I heard from a patient who felt reassured by my treatment plan. Their confidence in me feels like the highest form of trust.",Positive,2024-09-01 11:18:45,11,Positive Journal 97
98,exercises/1/2024_09_20/Landmark_1_brian.mp3,"Today, a patient expressed trust in my care, which felt incredibly validating. Their words reinforced my dedication to patient-centered treatment.",Positive,2024-09-22 12:03:08,11,Positive Journal 98
99,exercises/1/2024_09_20/Landmark_1_brian.mp3,A family member approached me to thank me for the care I’ve been providing. It’s rewarding to know I’m helping bring peace to both patients and their families.,Positive,2024-09-17 09:32:40,11,Negative Journal 99
100,exercises/1/2024_09_20/Landmark_1_brian.mp3,"Today, I felt a deep sense of accomplishment when a patient expressed their trust and gratitude. It’s truly fulfilling to be part of their healing process.",Positive,2024-08-30 04:31:48,11,Negative Journal 100
101,exercises/1/2024_09_20/Landmark_1_brian.mp3,Receiving positive feedback about the treatment we provided was uplifting. It reminds me of the difference compassionate care can make.,Positive,2024-08-28 12:33:02,11,Negative Journal 101
102,exercises/1/2024_09_20/Landmark_1_brian.mp3,I felt a strong sense of connection with a patient who acknowledged the impact of our care on their healing journey. It’s the best kind of feedback.,Positive,2024-09-07 21:59:30,11,Negative Journal 102
103,exercises/1/2024_09_20/Landmark_1_brian.mp3,"Today, a patient praised our team’s efforts, saying they felt genuinely cared for and appreciated. It’s moments like these that bring fulfillment to my work.",Positive,2024-08-29 06:25:01,12,Negative Journal 103
104,exercises/1/2024_09_20/Landmark_1_brian.mp3,"Today, I saw a patient’s recovery progress in ways that felt truly inspiring. They thanked me for the compassionate care I provided, saying it helped them feel supported throughout their treatment. It’s moments like these that remind me why I’m here.",Positive,2024-09-07 03:33:22,12,Negative Journal 104
105,exercises/1/2024_09_20/Landmark_1_brian.mp3,"A patient’s family expressed their gratitude today, noting how much our team’s dedication meant to them during a difficult time. It’s always encouraging to see families recognize the work we put into patient care. Knowing we’ve helped bring peace to their lives is so rewarding.",Positive,2024-09-16 22:38:50,12,Negative Journal 105
106,exercises/1/2024_09_20/Landmark_1_brian.mp3,I felt deeply appreciated when a patient complimented the thoughtful attention they received from our team. Hearing their positive feedback reinforced the importance of showing empathy every day. I feel grateful to be able to make a meaningful impact.,Positive,2024-09-10 02:31:47,12,Negative Journal 106
107,exercises/1/2024_09_20/Landmark_1_brian.mp3,"One of my patients shared that they felt truly cared for and comfortable with our team’s approach to treatment. Their recovery has been a long journey, and seeing them trust the process means a lot. I’m thankful to play a part in their healing.",Positive,2024-09-20 15:06:49,12,Negative Journal 107
108,exercises/1/2024_09_20/Landmark_1_brian.mp3,"Today, I saw real progress in a patient’s recovery and felt proud of the role I played in their journey. The patient expressed sincere appreciation for my compassionate care, which made me feel connected to the purpose behind my work.",Positive,2024-09-07 02:52:31,12,Negative Journal 108
109,exercises/1/2024_09_20/Landmark_1_brian.mp3,A family member stopped by to thank me for the positive care experience their loved one received. It’s uplifting to know our efforts make patients feel safe and supported. Their gratitude brought a smile to my face and fueled my motivation.,Positive,2024-09-12 17:28:43,12,Negative Journal 109
110,exercises/1/2024_09_20/Landmark_1_brian.mp3,I saw a patient make remarkable progress in their treatment today. Their family was overjoyed and thanked me for my dedication to their recovery. It’s a wonderful feeling to know that our team’s efforts are appreciated and trusted. This kind of feedback makes all the hard work worth it.,Positive,2024-09-10 05:28:21,12,Negative Journal 110
111,exercises/1/2024_09_20/Landmark_1_brian.mp3,"A patient shared that they feel hopeful and positive about their treatment after our recent sessions. Their optimism is inspiring, and it fills me with pride to be part of their healing journey. Knowing that my encouragement has helped them find confidence in their progress is incredibly rewarding. It’s these uplifting moments that make every challenge worthwhile.",Positive,2024-09-08 07:00:19,12,Negative Journal 111
112,exercises/1/2024_09_20/Landmark_1_brian.mp3,"A patient today thanked me for listening to their concerns and adapting the treatment plan to fit their needs. Their words were a reminder of the importance of empathy and flexibility in care. They felt truly heard, which is something I always aim for. It was a fulfilling moment that reinforced my commitment to patient-centered care.",Positive,2024-09-14 08:11:12,12,Negative Journal 112
113,exercises/1/2024_09_20/Landmark_1_brian.mp3,A patient’s family expressed their gratitude for the compassionate care their loved one received during a difficult time. It’s so fulfilling to know that our work not only helps patients but also brings peace to their families. Their gratitude gave me the energy to keep pushing forward. Days like today remind me how important this work truly is.,Positive,2024-08-28 10:29:31,13,Negative Journal 113
114,exercises/1/2024_09_20/Landmark_1_brian.mp3,"One of my patients today thanked me for explaining the treatment plan in detail, which helped ease their anxiety. They said they felt empowered and informed, and I could see a shift in their confidence. Knowing I helped make their journey smoother is deeply satisfying. It’s moments like these that show me the impact of empathy and communication.",Positive,2024-08-26 15:54:41,13,Negative Journal 114
115,exercises/1/2024_09_20/Landmark_1_brian.mp3,"Today, I witnessed a patient make strides in their recovery, and they thanked me for my encouragement and support. Their success felt like my success, too, and I couldn’t help but feel proud of them. Seeing the joy and relief in their eyes reminded me of why I’m here. This connection is what makes every day meaningful.",Positive,2024-09-17 11:01:38,14,Negative Journal 115
116,exercises/1/2024_09_20/Landmark_1_brian.mp3,"A patient’s family member today expressed how grateful they were for the compassion and dedication we showed their loved one. They mentioned feeling at peace, knowing their family member was in good hands. Their trust means a lot and reinforces the importance of our work. I left feeling deeply motivated and grateful for their kindness.",Positive,2024-09-05 09:55:54,15,Negative Journal 116
117,exercises/1/2024_09_20/Landmark_1_brian.mp3,"Today, a patient thanked me for going the extra mile to make their stay comfortable. They mentioned that even though the treatment was challenging, my support made a real difference. It was heartwarming to hear that my efforts didn’t go unnoticed. These moments make the hard work feel rewarding.",Positive,2024-09-13 05:58:26,15,Negative Journal 117
118,exercises/1/2024_09_20/Landmark_1_brian.mp3,"A patient told me today that they felt like they were treated as a person and not just a case. Their words touched me deeply, reminding me of the value of human connection in healthcare. It’s fulfilling to know that my approach helped them feel valued. This connection is what drives me to bring my best every day.",Positive,2024-09-15 13:04:52,16,Positive Journal 118
119,exercises/1/2024_09_20/Landmark_1_brian.mp3,"Today, I had a heartfelt conversation with a patient who shared how our care has helped them feel hopeful and optimistic. Their gratitude was incredibly touching, and I felt privileged to be part of their healing journey. It’s these conversations that bring meaning to my work. Knowing I made a positive impact on their outlook means so much.",Positive,2024-08-29 12:30:53,16,Negative Journal 119
120,exercises/1/2024_09_20/Landmark_1_brian.mp3,A patient expressed how grateful they were for my attention to detail and patience during a tough treatment. Their kind words reaffirmed that my efforts to provide thorough care make a real difference. Seeing them uplifted despite the challenges was inspiring. It reminded me that every small gesture counts.,Positive,2024-09-11 19:56:26,16,Negative Journal 120
121,exercises/1/2024_09_20/Landmark_1_brian.mp3,"One of my patients today expressed that they felt genuinely cared for, not just treated. It’s fulfilling to know that my approach helps build trust and makes them feel secure. Their feedback reinforced the importance of compassion in care. It’s moments like these that give purpose to the work we do.",Positive,2024-09-06 08:20:01,16,Positive Journal 121
122,exercises/1/2024_09_20/Landmark_1_brian.mp3,"Today, a patient thanked me for my kindness and patience throughout their treatment. They said it was comforting to have someone they could rely on during such a challenging time. Knowing I helped ease their experience felt deeply rewarding. This is the kind of impact I aim for in every interaction.",Positive,2024-09-09 10:34:59,16,Positive Journal 122
123,exercises/1/2024_09_20/Landmark_1_brian.mp3,A patient’s family member shared how much they appreciated the time and energy I devoted to their loved one’s care. It’s so encouraging to know our work impacts families just as much as the patients themselves. Their gratitude brightened my day and gave me a renewed sense of purpose. Moments like this are the essence of healthcare.,Positive,2024-08-31 07:52:31,16,Negative Journal 123
124,exercises/1/2024_09_20/Landmark_1_brian.mp3,"Today, a patient thanked me for explaining each step of their treatment, saying it helped them feel more confident and less afraid. Seeing them relaxed and hopeful was incredibly rewarding. Their gratitude reminded me of the importance of clear communication. It’s these simple acts that create meaningful connections.",Positive,2024-08-29 20:16:42,16,Positive Journal 124
125,exercises/1/2024_09_20/Landmark_1_brian.mp3,"A patient who had been skeptical at first thanked me today, saying my patience and empathy had changed their experience. Their trust grew over time, which was incredibly fulfilling to witness. Knowing that my consistency made them feel supported gives me a deep sense of accomplishment. It’s why I’m committed to showing compassion, no matter what.",Positive,2024-09-09 12:27:18,16,Positive Journal 125
126,exercises/1/2024_09_20/Landmark_1_brian.mp3,"Today, a patient shared that my positive attitude and care helped them find the strength to keep pushing through recovery. Hearing that I played a part in uplifting their spirit meant the world to me. Their gratitude was a reminder of the powerful role of encouragement in healing. It’s moments like this that make every challenge worth facing.",Positive,2024-09-24 06:08:52,16,Negative Journal 126
127,exercises/1/2024_09_20/Landmark_1_brian.mp3,One of my patients told me they felt a sense of calm and comfort knowing I was there for them. Their trust reinforced the importance of presence and empathy in care. It was a reminder that the smallest gestures can make a big impact on someone’s experience. Knowing I brought them peace made my day.,Positive,2024-09-13 17:11:26,16,Negative Journal 127
128,exercises/1/2024_09_20/Landmark_1_brian.mp3,A patient’s family member thanked me for being attentive and supportive throughout a difficult procedure. They mentioned how comforting it was to know someone genuinely cared for their loved one. Their appreciation reinforced the impact of empathy in healthcare. I left feeling deeply fulfilled and proud of the work we do.,Positive,2024-09-06 10:48:34,16,Positive Journal 128
129,exercises/1/2024_09_20/Landmark_1_brian.mp3,"I dealt with a patient who refused to cooperate during treatment, which made the whole process more stressful. I wish there was more time to address their concerns.",Negative,2024-09-04 15:19:34,16,Negative Journal 129
130,exercises/1/2024_09_20/Landmark_1_brian.mp3,The lack of resources left me unable to provide the level of care my patient deserved. It’s frustrating to see them dissatisfied because of system limitations.,Negative,2024-09-10 06:58:58,16,Negative Journal 130
131,exercises/1/2024_09_20/Landmark_1_brian.mp3,"A family member insisted on procedures that weren’t necessary, creating tension. It’s challenging to maintain patience when they don’t understand the full picture.",Negative,2024-09-04 20:11:53,16,Positive Journal 131
132,exercises/1/2024_09_20/Landmark_1_brian.mp3,I was verbally abused by a patient today who was frustrated with their wait time. It’s hard to stay compassionate when treated with such hostility.,Negative,2024-09-10 01:25:32,16,Negative Journal 132
133,exercises/1/2024_09_20/Landmark_1_brian.mp3,"Today, I had to manage an uncooperative patient who kept delaying their treatment. It made an already packed schedule even harder to handle.",Negative,2024-09-22 12:17:45,17,Negative Journal 133
134,exercises/1/2024_09_20/Landmark_1_brian.mp3,"A patient expressed distrust in the care plan, openly questioning our competence. Moments like these make it difficult to stay motivated.",Negative,2024-09-20 13:40:02,17,Negative Journal 134
135,exercises/1/2024_09_20/Landmark_1_brian.mp3,"Due to time constraints, I couldn’t provide the emotional support my patient needed. It feels like I’m letting them down when I have to rush through care.",Negative,2024-09-25 02:10:27,17,Negative Journal 135
136,exercises/1/2024_09_20/Landmark_1_brian.mp3,"The family of a patient demanded constant updates, adding pressure to an already stressful day. It’s hard to manage when they don’t appreciate our limitations.",Negative,2024-08-26 13:31:06,17,Negative Journal 136
137,exercises/1/2024_09_20/Landmark_1_brian.mp3,"A patient was confrontational during their entire appointment, challenging everything I said. It made an already difficult day even more taxing.",Negative,2024-09-06 02:05:38,17,Negative Journal 137
138,exercises/1/2024_09_20/Landmark_1_brian.mp3,"I faced empathy fatigue today, struggling to offer compassion amid constant complaints. It’s exhausting to stay engaged when you feel emotionally drained.",Negative,2024-09-03 18:40:38,17,Negative Journal 138
139,exercises/1/2024_09_20/Landmark_1_brian.mp3,"A patient’s family insisted on special treatment, refusing to understand our need to prioritize others. It’s frustrating when expectations are so unrealistic.",Negative,2024-09-11 03:23:39,17,Negative Journal 139
140,exercises/1/2024_09_20/Landmark_1_brian.mp3,I had an uncooperative patient today who refused to follow simple instructions. The resistance adds so much stress to my day.,Negative,2024-09-14 15:20:09,17,Negative Journal 140
141,exercises/1/2024_09_20/Landmark_1_brian.mp3,"A family member kept criticizing our approach, saying it wasn’t enough. It’s hard not to take such accusations personally.",Negative,2024-09-07 06:24:33,17,Negative Journal 141
142,exercises/1/2024_09_20/Landmark_1_brian.mp3,"Today, I felt emotionally distant due to a challenging interaction with a frustrated patient. It’s tough to balance empathy when their anger is directed at you.",Negative,2024-09-16 18:35:24,17,Negative Journal 142
143,exercises/1/2024_09_20/Landmark_1_brian.mp3,"Due to a shortage of staff, I couldn’t spend enough time with a patient who was visibly upset. They felt neglected and repeatedly questioned why we weren’t more attentive. Explaining the limitations without sounding dismissive was a real challenge. By the end of it, I felt like I’d failed to meet their needs despite my best efforts.",Negative,2024-09-22 02:30:25,17,Negative Journal 143
144,exercises/1/2024_09_20/Landmark_1_brian.mp3,"A patient today openly expressed distrust in our care approach, saying they didn’t believe in the treatment plan. Their lack of faith was discouraging, especially since we’re committed to providing the best care possible. It’s difficult to see patients lose confidence when we’re constrained by resources and time. I left the encounter feeling deflated.",Negative,2024-09-10 09:15:23,18,Positive Journal 144
145,exercises/1/2024_09_20/Landmark_1_brian.mp3,"Today, I had to deal with a family member who was insistent on unnecessary interventions for their loved one. I tried to explain the reasoning behind our approach, but they were adamant, even accusing us of negligence. Their words stung, and it was hard to shake off the feeling of being unfairly judged. It’s exhausting to face such resistance when all I want is to help.",Negative,2024-08-26 06:51:43,18,Positive Journal 145
146,exercises/1/2024_09_20/Landmark_1_brian.mp3,"A patient’s constant complaints about wait times made me feel frustrated and unable to provide the care I intended. Despite explaining our limitations, they remained upset, making it hard to connect with them empathetically. I could feel myself growing emotionally distant, which isn’t how I want to approach my work. These interactions are draining and impact the care I can give others.",Negative,2024-09-05 22:20:11,18,Negative Journal 146
147,exercises/1/2024_09_20/Landmark_1_brian.mp3,"Today, I felt overwhelmed by a patient’s unrealistic expectations for immediate, constant attention. Balancing their demands with other responsibilities left me feeling pulled in every direction. It’s tough when patients don’t understand that we’re stretched thin, and I worry they feel neglected. I left feeling emotionally drained and worried I hadn’t met their needs.",Negative,2024-09-05 18:13:04,18,Negative Journal 147
148,exercises/1/2024_09_20/Landmark_1_brian.mp3,"A difficult conversation with a patient’s family today became confrontational when they began accusing us of not doing enough. Their expectations didn’t align with what was feasible, and it felt like they didn’t trust us to provide the best care. Trying to remain calm and professional was challenging under such pressure. By the end, I felt deeply drained and questioned how effective I’d been.",Negative,2024-09-05 03:03:18,18,Negative Journal 148
149,exercises/1/2024_09_20/Landmark_1_brian.mp3,"Today, I dealt with a patient who resisted every suggestion I made for their treatment. They openly challenged my expertise, and it was hard to stay calm in the face of such resistance. It’s difficult to remain patient and understanding when your knowledge and care are doubted. This interaction left me questioning my own capabilities and emotionally exhausted.",Negative,2024-09-01 12:41:05,18,Negative Journal 149
150,exercises/1/2024_09_20/Landmark_1_brian.mp3,"A family member today refused to accept our diagnosis, demanding a second opinion and making accusatory remarks. It’s tough to stay composed when your care is constantly questioned, especially by someone who doesn’t understand the full medical picture. Their lack of trust weighed heavily on me throughout the day. By the end of my shift, I felt emotionally worn out and discouraged.",Negative,2024-09-19 23:33:01,18,Negative Journal 150
151,exercises/1/2024_09_20/Landmark_1_brian.mp3,"Today, I was caught in a tense exchange with a patient’s relative who kept insisting on additional tests. Despite explaining that the tests weren’t medically necessary, they didn’t seem satisfied and grew increasingly frustrated. Their impatience and disregard for our expertise made it difficult to maintain my composure. By the end, I felt drained and disheartened, wondering if they understood the limitations we face.",Negative,2024-09-13 19:32:20,18,Negative Journal 151
152,exercises/1/2024_09_20/Landmark_1_brian.mp3,"One of my patients was particularly difficult today, challenging every aspect of their treatment plan. Their resistance to cooperate made the session stressful, and I felt myself becoming defensive, which isn’t how I want to approach patient care. I tried to stay calm, but the tension was palpable. It was one of those days where empathy fatigue was hard to ignore.",Negative,2024-09-11 19:47:53,18,Negative Journal 152
153,exercises/1/2024_09_20/Landmark_1_brian.mp3,"A family member today was upset that we couldn’t accommodate their request for an immediate change in the care plan. I explained the necessity of following established procedures, but they were visibly dissatisfied and even hinted that we weren’t prioritizing their loved one. Their disappointment was palpable and made me question whether I had done enough to convey our reasoning. I left feeling conflicted, torn between empathy and frustration.",Negative,2024-09-20 06:32:20,19,Negative Journal 153
154,exercises/1/2024_09_20/Landmark_1_brian.mp3,"Today, I had an emotionally taxing interaction with a patient who was dismissive of our recommended course of action. Despite my efforts to reassure them, they remained skeptical and made it clear they didn’t trust my judgment. The exchange left me feeling both frustrated and inadequate, struggling to maintain confidence in my own expertise. By the end of the conversation, I was emotionally exhausted.",Negative,2024-09-02 22:45:40,19,Negative Journal 154
155,exercises/1/2024_09_20/Landmark_1_brian.mp3,"A patient today was insistent on alternative treatments that weren’t medically recommended, refusing to consider our standard approach. Navigating their demands while maintaining professionalism was difficult, as they were clearly unhappy with my responses. Each attempt to clarify seemed to fuel their frustration, creating a negative atmosphere. I walked away feeling emotionally drained, questioning if there was a better way to reach an understanding.",Negative,2024-09-16 22:20:23,19,Negative Journal 155
156,exercises/1/2024_09_20/Landmark_1_brian.mp3,"It’s tough seeing the team struggle with burnout. With the current workload, it feels like we’re constantly stretched thin.",Negative,2024-09-20 03:09:03,19,Positive Journal 156
157,exercises/1/2024_09_20/Landmark_1_brian.mp3,"Today, I felt unrecognized for the extra effort I put in. It’s discouraging when leadership doesn’t acknowledge the hard work.",Negative,2024-09-02 17:14:28,20,Negative Journal 157
158,exercises/1/2024_09_20/Landmark_1_brian.mp3,"Another day, another case of insufficient manpower. The extra workload affects not only productivity but also our morale.",Negative,2024-08-29 22:19:21,20,Negative Journal 158
159,exercises/1/2024_09_20/Landmark_1_brian.mp3,"Leadership seems detached from our daily challenges. Without their support, tackling these issues feels like an uphill battle.",Negative,2024-09-12 16:16:15,20,Negative Journal 159
160,exercises/1/2024_09_20/Landmark_1_brian.mp3,It’s disheartening to work hard every day and feel a lack of respect from those higher up. I feel the need for more recognition.,Negative,2024-08-26 20:38:41,20,Positive Journal 160
161,exercises/1/2024_09_20/Landmark_1_brian.mp3,"The constant workload is starting to feel overwhelming, and the team’s frustration is growing. We’re all stretched so thin with little support.",Negative,2024-09-10 23:23:43,20,Negative Journal 161
162,exercises/1/2024_09_20/Landmark_1_brian.mp3,I faced another day of unclear expectations. It’s exhausting to try to juggle everything without a clear definition of my role.,Negative,2024-09-07 23:38:29,20,Negative Journal 162
163,exercises/1/2024_09_20/Landmark_1_brian.mp3,"There’s a lack of recognition here, and it’s starting to affect morale. Working hard without acknowledgment is tough.",Negative,2024-09-15 11:37:29,20,Negative Journal 163
164,exercises/1/2024_09_20/Landmark_1_brian.mp3,"Today, I encountered more disrespect from leadership. It’s disheartening to feel undervalued despite the effort I put in.",Negative,2024-08-26 14:29:54,20,Positive Journal 164
165,exercises/1/2024_09_20/Landmark_1_brian.mp3,The constant shifts in manpower make it hard to manage our workload. It’s frustrating to always be understaffed.,Negative,2024-08-28 16:11:52,20,Negative Journal 165
